[
  {
    "sensor_id": "RAUM-204-T1",
    "zeitpunkt": "2026-09-14T08:00:00+02:00",
    "temperatur_c": 18.3,
    "luftfeuchte_prozent": 63.9,
    "co2_ppm": 569,
    "fenster_offen": false
  },
  {
    "sensor_id": "RAUM-204-T1",
    "zeitpunkt": "2026-09-14T10:00:00+02:00",
    "temperatur_c": 18.9,
    "luftfeuchte_prozent": 64.2,
    "co2_ppm": 894,
    "fenster_offen": false
  },
  {
    "sensor_id": "RAUM-204-T1",
    "zeitpunkt": "2026-09-14T12:00:00+02:00",
    "temperatur_c": 20.4,
    "luftfeuchte_prozent": 62.4,
    "co2_ppm": 739,
    "fenster_offen": false
  },
  {
    "sensor_id": "RAUM-204-T1",
    "zeitpunkt": "2026-09-14T14:00:00+02:00",
    "temperatur_c": 21.1,
    "luftfeuchte_prozent": 57.5,
    "co2_ppm": 612,
    "fenster_offen": true
  },
  {
    "sensor_id": "RAUM-204-T1",
    "zeitpunkt": "2026-09-14T16:00:00+02:00",
    "temperatur_c": 21.6,
    "luftfeuchte_prozent": 58.3,
    "co2_ppm": 748,
    "fenster_offen": false
  },
  {
    "sensor_id": "RAUM-204-T1",
    "zeitpunkt": "2026-09-15T08:00:00+02:00",
    "temperatur_c": 18.9,
    "luftfeuchte_prozent": 64.4,
    "co2_ppm": 583,
    "fenster_offen": false
  },
  {
    "sensor_id": "RAUM-204-T1",
    "zeitpunkt": "2026-09-15T10:00:00+02:00",
    "temperatur_c": 19.7,
    "luftfeuchte_prozent": 61.8,
    "co2_ppm": 746,
    "fenster_offen": false
  },
  {
    "sensor_id": "RAUM-204-T1",
    "zeitpunkt": "2026-09-15T12:00:00+02:00",
    "temperatur_c": 20.0,
    "luftfeuchte_prozent": 63.0,
    "co2_ppm": 816,
    "fenster_offen": false
  },
  {
    "sensor_id": "RAUM-204-T1",
    "zeitpunkt": "2026-09-15T14:00:00+02:00",
    "temperatur_c": 21.5,
    "luftfeuchte_prozent": 58.6,
    "co2_ppm": 1093,
    "fenster_offen": true
  },
  {
    "sensor_id": "RAUM-204-T1",
    "zeitpunkt": "2026-09-15T16:00:00+02:00",
    "temperatur_c": 22.0,
    "luftfeuchte_prozent": 57.5,
    "co2_ppm": 1174,
    "fenster_offen": false
  },
  {
    "sensor_id": "RAUM-204-T1",
    "zeitpunkt": "2026-09-16T08:00:00+02:00",
    "temperatur_c": 18.6,
    "luftfeuchte_prozent": 63.1,
    "co2_ppm": 584,
    "fenster_offen": false
  },
  {
    "sensor_id": "RAUM-204-T1",
    "zeitpunkt": "2026-09-16T10:00:00+02:00",
    "temperatur_c": 20.0,
    "luftfeuchte_prozent": 62.1,
    "co2_ppm": 1028,
    "fenster_offen": false
  },
  {
    "sensor_id": "RAUM-204-T1",
    "zeitpunkt": "2026-09-16T12:00:00+02:00",
    "temperatur_c": 21.0,
    "luftfeuchte_prozent": 59.1,
    "co2_ppm": 841,
    "fenster_offen": true
  },
  {
    "sensor_id": "RAUM-204-T1",
    "zeitpunkt": "2026-09-16T14:00:00+02:00",
    "temperatur_c": 22.2,
    "luftfeuchte_prozent": 56.2,
    "co2_ppm": 774,
    "fenster_offen": true
  },
  {
    "sensor_id": "RAUM-204-T1",
    "zeitpunkt": "2026-09-16T16:00:00+02:00",
    "temperatur_c": 22.8,
    "luftfeuchte_prozent": 54.4,
    "co2_ppm": 1108,
    "fenster_offen": false
  },
  {
    "sensor_id": "RAUM-204-T1",
    "zeitpunkt": "2026-09-17T08:00:00+02:00",
    "temperatur_c": 19.0,
    "luftfeuchte_prozent": 63.8,
    "co2_ppm": 871,
    "fenster_offen": false
  },
  {
    "sensor_id": "RAUM-204-T1",
    "zeitpunkt": "2026-09-17T10:00:00+02:00",
    "temperatur_c": 20.4,
    "luftfeuchte_prozent": 59.9,
    "co2_ppm": 594,
    "fenster_offen": false
  },
  {
    "sensor_id": "RAUM-204-T1",
    "zeitpunkt": "2026-09-17T12:00:00+02:00",
    "temperatur_c": 20.6,
    "luftfeuchte_prozent": 60.0,
    "co2_ppm": 870,
    "fenster_offen": false
  },
  {
    "sensor_id": "RAUM-204-T1",
    "zeitpunkt": "2026-09-17T14:00:00+02:00",
    "temperatur_c": 21.9,
    "luftfeuchte_prozent": 55.6,
    "co2_ppm": 599,
    "fenster_offen": true
  },
  {
    "sensor_id": "RAUM-204-T1",
    "zeitpunkt": "2026-09-17T16:00:00+02:00",
    "temperatur_c": 22.9,
    "luftfeuchte_prozent": 56.7,
    "co2_ppm": 841,
    "fenster_offen": false
  },
  {
    "sensor_id": "RAUM-204-T1",
    "zeitpunkt": "2026-09-18T08:00:00+02:00",
    "temperatur_c": 19.3,
    "luftfeuchte_prozent": 62.5,
    "co2_ppm": 1028,
    "fenster_offen": false
  },
  {
    "sensor_id": "RAUM-204-T1",
    "zeitpunkt": "2026-09-18T10:00:00+02:00",
    "temperatur_c": 20.5,
    "luftfeuchte_prozent": 60.3,
    "co2_ppm": 615,
    "fenster_offen": false
  },
  {
    "sensor_id": "RAUM-204-T1",
    "zeitpunkt": "2026-09-18T12:00:00+02:00",
    "temperatur_c": 21.8,
    "luftfeuchte_prozent": 57.5,
    "co2_ppm": 586,
    "fenster_offen": false
  },
  {
    "sensor_id": "RAUM-204-T1",
    "zeitpunkt": "2026-09-18T14:00:00+02:00",
    "temperatur_c": 22.4,
    "luftfeuchte_prozent": 56.9,
    "co2_ppm": 976,
    "fenster_offen": false
  },
  {
    "sensor_id": "RAUM-204-T1",
    "zeitpunkt": "2026-09-18T16:00:00+02:00",
    "temperatur_c": 23.0,
    "luftfeuchte_prozent": 55.7,
    "co2_ppm": 543,
    "fenster_offen": false
  },
  {
    "sensor_id": "RAUM-204-T1",
    "zeitpunkt": "2026-09-19T08:00:00+02:00",
    "temperatur_c": 20.3,
    "luftfeuchte_prozent": 60.4,
    "co2_ppm": 1145,
    "fenster_offen": false
  },
  {
    "sensor_id": "RAUM-204-T1",
    "zeitpunkt": "2026-09-19T10:00:00+02:00",
    "temperatur_c": 20.2,
    "luftfeuchte_prozent": 59.4,
    "co2_ppm": 814,
    "fenster_offen": false
  },
  {
    "sensor_id": "RAUM-204-T1",
    "zeitpunkt": "2026-09-19T12:00:00+02:00",
    "temperatur_c": 21.1,
    "luftfeuchte_prozent": 58.2,
    "co2_ppm": 920,
    "fenster_offen": true
  },
  {
    "sensor_id": "RAUM-204-T1",
    "zeitpunkt": "2026-09-19T14:00:00+02:00",
    "temperatur_c": 22.4,
    "luftfeuchte_prozent": 55.0,
    "co2_ppm": 931,
    "fenster_offen": true
  },
  {
    "sensor_id": "RAUM-204-T1",
    "zeitpunkt": "2026-09-19T16:00:00+02:00",
    "temperatur_c": 23.8,
    "luftfeuchte_prozent": 54.5,
    "co2_ppm": 1083,
    "fenster_offen": false
  },
  {
    "sensor_id": "RAUM-204-T1",
    "zeitpunkt": "2026-09-20T08:00:00+02:00",
    "temperatur_c": 19.7,
    "luftfeuchte_prozent": 61.9,
    "co2_ppm": 887,
    "fenster_offen": false
  },
  {
    "sensor_id": "RAUM-204-T1",
    "zeitpunkt": "2026-09-20T10:00:00+02:00",
    "temperatur_c": 21.1,
    "luftfeuchte_prozent": 58.7,
    "co2_ppm": 756,
    "fenster_offen": false
  },
  {
    "sensor_id": "RAUM-204-T1",
    "zeitpunkt": "2026-09-20T12:00:00+02:00",
    "temperatur_c": 21.4,
    "luftfeuchte_prozent": 57.2,
    "co2_ppm": 757,
    "fenster_offen": true
  },
  {
    "sensor_id": "RAUM-204-T1",
    "zeitpunkt": "2026-09-20T14:00:00+02:00",
    "temperatur_c": 22.1,
    "luftfeuchte_prozent": 58.3,
    "co2_ppm": 706,
    "fenster_offen": false
  },
  {
    "sensor_id": "RAUM-204-T1",
    "zeitpunkt": "2026-09-20T16:00:00+02:00",
    "temperatur_c": 23.0,
    "luftfeuchte_prozent": 54.7,
    "co2_ppm": 898,
    "fenster_offen": false
  }
]